{
  "profile_id": "lrp-chip-readpath-sw616c-001",
  "golden_pair_id": "lrp-golden-baseline-001",
  "lrp_arm": "chip",
  "fault_class": "read-path",
  "fault_detail": {
    "summary": "READ BINARY on EF.DG2 returns ISO/IEC 7816-4 status 6Cxx (wrong Le) instead of 9000 while golden bytes are unchanged on the simulated chip",
    "normative_refs": [
      "ISO/IEC 7816-4 status bytes SW1-SW2",
      "BSI TR-03105 Part 3.1 read-path conformance"
    ],
    "injection_site": "Simulator transceiver: EF.DG2 READ BINARY response SW1=6C, SW2=correct Le"
  },
  "expected_attribution": "chip",
  "files": {
    "EF.DG1": "dg1.bin",
    "EF.DG2": "dg2.bin",
    "EF.SOD": "sod.bin"
  },
  "provenance": {
    "harness_version": "0.1.0",
    "created_at": "2026-08-30T16:00:00Z",
    "notes": "Manifest exemplar — on-chip byte files not yet published; chip fault is simulator response path only"
  }
}
