{
  "profile_id": "lrp-golden-baseline-001",
  "lrp_arm": "golden",
  "fault_class": "control",
  "fault_detail": {
    "summary": "Conformant golden baseline — 5F2E DG2, EF.COM present, no injected fault",
    "normative_refs": ["ICAO Doc 9303 Part 10 §4.6.1, §4.6.2, §4.7.1, §4.7.2"]
  },
  "expected_attribution": "golden",
  "files": {
    "EF.COM": "com.bin",
    "EF.DG1": "dg1.bin",
    "EF.DG2": "dg2.bin",
    "EF.SOD": "sod.bin"
  },
  "provenance": {
    "harness_version": "0.1.0-prebuild",
    "created_at": "2026-08-30T14:00:00Z",
    "notes": "Manifest exemplar — on-chip byte files not yet published"
  }
}
