{
  "profile_id": "lrp-reader-sodlisted-dg3-001",
  "golden_pair_id": "lrp-golden-baseline-001",
  "lrp_arm": "reader-implicating",
  "fault_class": "sod-listed-unreadable",
  "fault_detail": {
    "summary": "EF.SOD lists DG3 per conformant EAC issuance; EF.DG3 unreadable without EAC on BAC-only path — tests whether reader distinguishes unverifiable SOD entry from hash failure",
    "normative_refs": [
      "ICAO Doc 9303 Part 10 §4.6.2 EF.SOD; §4.7.3 EF.DG3",
      "BSI TR-03110 (EAC read precondition)"
    ],
    "structural_class": "0x63",
    "injection_site": "EF.SOD lists DG3; EF.DG3 requires EAC for READ BINARY — BAC-only path"
  },
  "conformance_basis": {
    "document": "ICAO Doc 9303 Part 10; BSI TR-03110",
    "clause": "Part 10 §4.6.2 (EF.SOD DG hash list); §4.7.3 (DG3); TR-03110 EAC access precondition",
    "edition": "Part 10, 8th ed. (2021); TR-03110",
    "summary": "Listing DG3 in EF.SOD while EF.DG3 requires EAC for read matches conformant EAC passport construction; a BAC-only terminal legitimately cannot read EF.DG3 — not a writer defect"
  },
  "expected_attribution": "reader-implicating",
  "files": {
    "EF.DG1": "dg1.bin",
    "EF.DG2": "dg2.bin",
    "EF.SOD": "sod-dg3-listed.bin"
  },
  "provenance": {
    "harness_version": "0.1.0-prebuild",
    "created_at": "2026-08-30T18:00:00Z",
    "notes": "Retagged reader-implicating 2026-08-30; replaces lrp-writer-sodlisted-dg3-001"
  },
  "dg_scope": {
    "representative_dg": "DG3",
    "structural_class_tag": "0x63",
    "excluded_near_duplicates": ["DG4"]
  }
}
