{
  "profile_id": "lrp-reader-ber-longlength-dg2-001",
  "golden_pair_id": "lrp-golden-baseline-001",
  "lrp_arm": "reader-implicating",
  "fault_class": "uncommon-encoding",
  "fault_detail": {
    "summary": "EF.DG2 wrapped with valid BER-TLV definite long-form length encoding (non-shortest length octets)",
    "normative_refs": [
      "ICAO Doc 9303 Part 10 §3.6, §4.2",
      "ISO/IEC 7816-4 BER-TLV length fields"
    ],
    "structural_class": "0x75",
    "injection_site": "EF.DG2 outer TLV length field"
  },
  "conformance_basis": {
    "document": "ICAO Doc 9303 Part 10; ISO/IEC 7816-4",
    "clause": "Part 10 §3.6 (BER-TLV); §4.2 (ASN.1 TLV DGs); ISO/IEC 7816-4 BER-TLV length fields",
    "edition": "Part 10, 8th ed. (2021)",
    "summary": "DG files use BER-TLV; non-shortest definite length is spec-legal though not RECOMMENDED — tests strict shortest-length-only parsers"
  },
  "expected_attribution": "reader-implicating",
  "files": {
    "EF.DG1": "dg1.bin",
    "EF.DG2": "dg2-ber-longlength.bin",
    "EF.SOD": "sod.bin"
  },
  "dg_scope": {
    "representative_dg": "DG2",
    "structural_class_tag": "0x75"
  },
  "provenance": {
    "harness_version": "0.1.0-prebuild",
    "created_at": "2026-08-30T14:00:00Z",
    "notes": "EF.SOD remains DER per §4.6.2.2 — long-form length applies to DG TLV wrapper only"
  }
}
