{
  "profile_id": "lrp-writer-trustchain-dsc-expired-001",
  "golden_pair_id": "lrp-golden-baseline-001",
  "lrp_arm": "writer",
  "fault_class": "trust-chain",
  "validation_time": "2026-06-15T12:00:00Z",
  "fault_detail": {
    "summary": "Document Signer Certificate notValidAfter precedes pinned validation_time — LDS bytes match golden; PA must fail on chain validity",
    "normative_refs": [
      "RFC 5280 §5.3 certificate validity",
      "ICAO Doc 9303 Part 10 §4.6.2 EF.SOD"
    ],
    "injection_site": "EF.SOD CMS SignedData signer DSC notValidAfter < validation_time"
  },
  "expected_attribution": "writer",
  "lab_pki": {
    "csca_ref": "pki/csca-lab-001.pem",
    "dsc_ref": "pki/dsc-expired-lab-001.pem",
    "injection": "dsc-expired"
  },
  "files": {
    "EF.DG1": "dg1.bin",
    "EF.DG2": "dg2.bin",
    "EF.SOD": "sod-dsc-expired.bin"
  },
  "provenance": {
    "harness_version": "0.1.0",
    "created_at": "2026-08-30T16:00:00Z",
    "notes": "Manifest exemplar — lab PKI bytes and stable file hashes recorded at generation time"
  }
}
